A5 LOCAÇÕES LTDA;A5 LOCAÇÕES;"10.649.059/0001-69";Sociedade Empresária;;Empresa de Pequeno Porte;Em Operação;Locadora de Veículos;Aluguel de Veículos;59.500.000;RN;Macau;Macau;R ILHA DE SANTANA,160;(84) 99961-7490;;a5locacoes@hotmail.com;;;"20.076706.85.0001-5";"7711-0/00-LOCADORA DE AUTOMÓVEIS (Primário)";Nenhuma das Opções;0
EXCLUSIVE LOCADORA DE VANS E VEICULOS LTDA - ME;EXCLUSIVE LOCADORA DE VANS E VEICULOS LTDA - ME;"09.420.056/0001-70";Sociedade Empresária;;Microempresa;Em Operação;Locadora de Veículos;Aluguel de Veículos;2.801.010;SP;São Paulo;Vila Brasilândia;R NAGE , N°: 30 - GARAGEANTIGO N.20;(11) 3876-0174;;exclusive.locadora@hotmail.com;;;"26.069884.85.0001-8";"7711-0/00-LOCADORA DE AUTOMÓVEIS (Secundário)";Espanhol ,Japonês ,Inglês;0
RUY BARBOSA DE MIRANDA - ME;LOCADORA VAMOS DE VAN;"20.496.472/0001-94";Empresário Individual (Não MEI);;Microempresa;Em Operação;Locadora de Veículos;Aluguel de Veículos;79.006.230;MS;Campo Grande;Vila Taquarussu;RUA SÃO ROQUE Nº 516;(67) 9225-5051;(67) 3321-9504;ruy_bm@hotmail.com;;;"12.064561.85.0001-6";"7711-0/00-LOCADORA DE AUTOMÓVEIS (Primário)";Nenhuma das Opções;0
AMX LOCAÇÕES E EQUIPAMENTOS LTDA - ME;AMX LOCAÇÕES;"12.165.920/0001-49";Serviço Social Autônomo;;Microempresa;Em Operação;Locadora de Veículos;Aluguel de Veículos;36.070.000;MG;Juiz de Fora;Costa Carvalho;AV SETE DE SETEMBRO, Nº 861 - SALÃO;(32) 3213-2000;(32) 3221-6091;andersonarchis@hotmail.com;;;"11.081990.85.0001-1";"7711-0/00-LOCADORA DE AUTOMÓVEIS (Primário)";Inglês;0
MARCELO RODRIGUES RIOTO - ME;ESTOQUE VEICULOS;"11.621.970/0001-20";Empresário Individual (Não MEI);;Microempresa;Em Operação;Locadora de Veículos;Aluguel de Veículos;14.890.000;SP;Jaboticabal;Nova Jaboticabal;RUA SANTO ANDRE, 22;(16) 3204-1348;(16) 99239-0389;raquelbachini@hotmail.com;;www.estoqueveiculos.com.br;"26.080800.85.0001-4";"7711-0/00-LOCADORA DE AUTOMÓVEIS (Primário)";Nenhuma das Opções;0
COOPERATIVA DE MOTORISTAS PROF. TRANSP. DE PASSAGEIROS DE ALUGUEL E FRETAMENTO;COOPERATIVA ATLANTICOOP;"10.741.219/0001-03";Sociedade Empresária;;Microempresa;Em Operação;Locadora de Veículos;Aluguel de Veículos;20.735.120;RJ;Rio de Janeiro;Méier;RUA ANA BARBOSA, 36 SALA 203 - PARTE;(21) 2201-8505;(21) 2501-2363;leokorten@gmail.com;;;"19.042190.85.0001-2";"7711-0/00-LOCADORA DE AUTOMÓVEIS (Primário), 4929-9/01-TRANSPORTE RODOVIÁRIO COLETIVO DE PASSAGEIROS, SOB REGIME DE FRETAMENTO, MUNICIPAL (Secundário)";Espanhol ,Italiano ,Inglês;4
CEVOLO SERVICOS DE ALIMENTACAO EIRELI;CEVOLO SERVICOS DE ALIMENTACAO EIRELI;"17.695.642/0001-55";Empresa Individual (EIRELI);;Empresa de Pequeno Porte;Em Operação;Locadora de Veículos;Aluguel de Veículos;25.071.181;RJ;Duque de Caxias;Jardim Vinte e Cinco de Agosto;AV BRIGADEIRO LIMA E SILVA, 1939 SALA 208;(21) 2674-3955;;presidencia@gbcs.com.br;;;"19.069849.85.0001-3";"5620-1/02-BUFFET; SERVIÇO DE ALIMENTAÇÃO (Primário), 7719-5/99-TRAILERS SEM CONDUTOR; LOCAÇÃO DE, ALUGUEL DE (Secundário), 8230-0/01-ORGANIZAÇÃO, PRODUÇÃO E PROMOÇÃO DE ENCONTROS E CONGRESSOS, SERVIÇOS DE (Secundário), 7711-0/00-LOCADORA DE AUTOMÓVEIS (Secundário), 8230-0/01-ORGANIZAÇÃO, PRODUÇÃO E PROMOÇÃO DE EVENTOS, EXCETO CULTURAIS E ESPORTIVOS, SERVIÇOS DE (Secundário), 7719-5/99-MOTOCICLETAS; LOCAÇÃO DE, ALUGUEL DE (Secundário)";Espanhol ,Inglês;0
DUQUE & SANTOS FRETAMENTO LTDA - ME;D & S FRETAMENTO;"04.297.828/0001-04";Sociedade Empresária;;Microempresa;Em Operação;Locadora de Veículos;Aluguel de Veículos;12.580.000;SP;Roseira;Roseira;R ADAYL GARCIA DOS REIS, N°: 269 ;(12) 3646-3286;;ceciliamar2011@hotmail.com;;;"26.071970.85.0001-5";"7711-0/00-LOCADORA DE AUTOMÓVEIS (Secundário)";Nenhuma das Opções;0
VERÃO VEÍCULOS LTDA.-ME;VERÃO RENT A CAR;"08.267.154/0001-56";Sociedade Empresária;;Microempresa;Em Operação;Locadora de Veículos;Aluguel de Veículos;58.015.150;PB;João Pessoa;Jaguaribe;AV:SENADOR JOÃO LIRA, 212 CXPST 047;(83) 99986-7065;;postoverao@ig.com.br;;;"15.053923.85.0001-4";"7711-0/00-LOCADORA DE AUTOMÓVEIS (Primário), 7911-2/00-AGÊNCIA DE VIAGEM; SERVIÇO DE (Secundário)";Inglês;0
APOIO LOCADORA DE VEICULOS LTDA;APOIO LOCADORA;"11.516.423/0001-85";Sociedade Empresária;;Microempresa;Em Operação;Locadora de Veículos;Aluguel de Veículos;29.122.100;ES;Vila Velha;Glória;RUA MESTRE GOMES, 30;(27) 3045-5840;;michele@apoiolocadora.com;apoiolocadora@hotmail.com;www.apoiolocadora.com;"08.063222.85.0001-7";"7711-0/00-LOCADORA DE AUTOMÓVEIS (Primário)";Inglês;0
RICARDA LOPES ALVES - ME;SANTA FÉ TRANSPORTES;"18.180.319/0001-01";Empresário Individual (Não MEI);;Microempresa;Em Operação;Locadora de Veículos;Aluguel de Veículos;79.290.000;MS;Bonito;Bonito;RUA GERALDO LEITE, 956 - VILA AMÉRICA;(67) 9295-4869;(67) 3255-4051;alternativa_contabilidade@hotmail.com;;;"12.059116.85.0001-8";"7711-0/00-LOCADORA DE AUTOMÓVEIS (Secundário)";Espanhol;0
BESSA LOCADORA EIRELI - ME;TB TRANSPORTE EXECUIVO E TURISMO;"23.132.464/0001-57";Empresa Individual (EIRELI);;Microempresa;Em Operação;Locadora de Veículos;Aluguel de Veículos;31.130.620;MG;Belo Horizonte;Renascença;RUA PANEMA, 999 A;(31) 3433-3476;;tdb8.tur@gmail.com;;;"11.079582.85.0001-0";"7711-0/00-LOCADORA DE AUTOMÓVEIS (Secundário)";Nenhuma das Opções;0
SAVAL TRANSPORTES EIRELI -ME;SAVAL TRANSPORTES;"18.546.574/0001-25";Empresário Individual (Não MEI);;Microempresa;Em Operação;Locadora de Veículos;Aluguel de Veículos;95.840.000;RS;Triunfo;Triunfo;R MARECHAL DEODORO 500 SALA 02;(51) 8149-0710;;souzacartfrs@gmail.com;;;"23.079325.85.0001-8";"7711-0/00-LOCADORA DE AUTOMÓVEIS (Secundário)";Nenhuma das Opções;0
CESA RODAS COMERCIAL LTDA;CESA RODAS;"04.896.962/0001-21";Sociedade Empresária;;Empresa de Pequeno Porte;Em Operação;Locadora de Veículos;Aluguel de Veículos;54.515.070;PE;Cabo de Santo Agostinho;COHAB;RUA 27 Nº 26 E ;(81) 3518-3581;(81) 3518-3581;cesarrodas@hotmail.com;;;"16.082664.85.0001-9";"7711-0/00-LOCADORA DE AUTOMÓVEIS (Secundário)";Nenhuma das Opções;0
LOCAVANS LOCAÇÕES E TURISMO LTDA - ME;LOCAVANS;"11.366.361/0001-72";Sociedade Empresária;;Microempresa;Em Operação;Locadora de Veículos;Aluguel de Veículos;60.744.290;CE;Fortaleza;Passaré;RUA 2, Nº 71 - A CONJ RES. PASSARÉ;(85) 3232-7083;;jlrecept@hotmail.com;;;"06.071020.85.0001-2";"4929-9/01-TRANSPORTE RODOVIÁRIO COLETIVO DE PASSAGEIROS, SOB REGIME DE FRETAMENTO, MUNICIPAL (Secundário), 7711-0/00-LOCADORA DE AUTOMÓVEIS (Secundário)";Nenhuma das Opções;0
FORTALEZA LOCAÇAO E TURISMO EIRELI-ME;FORTALEZA LOCAÇAO E TURISMO ;"11.144.692/0001-68";Empresa Individual (EIRELI);;Empresa de Pequeno Porte;Em Operação;Locadora de Veículos;Aluguel de Veículos;28.055.050;RJ;Campos dos Goytacazes;Parque Corrientes;RUA AFONSO PEREIRA CALDAS, N° 80;(22) 3052-8532;;imslocadora@hotmail.com;;;"19.049668.85.0001-0";"7911-2/00-AGÊNCIA DE VIAGEM; SERVIÇO DE (Secundário), 7711-0/00-LOCADORA DE AUTOMÓVEIS (Secundário)";Nenhuma das Opções;0
LL LOCADORA DE VEICULOS LTDA;L & L LOCADORA DE VEICULOS;"04.540.771/0001-22";Sociedade Empresária;;Microempresa;Em Operação;Locadora de Veículos;Aluguel de Veículos;49.075.510;SE;Aracaju;Siqueira Campos;RUA RIO GRANDE DO SUL Nº 811;(79) 3241-3107;(79) 3241-3107;lllocadora@bol.com.br;;;"25.039458.85.0001-3";"4923-0/02-SERVIÇO DE TRANSPORTE DE PASSAGEIROS - LOCAÇÃO DE AUTOMÓVEIS COM MOTORISTA (Primário), 7711-0/00-LOCADORA DE AUTOMÓVEIS (Secundário)";Nenhuma das Opções;6
JOSÉ ROSA LOCAÇÕES-ME;NILSON TOUR;"24.897.988/0001-00";Empresário Individual (Não MEI);;Microempresa;Em Operação;Locadora de Veículos;Aluguel de Veículos;35.930.360;MG;João Monlevade;Metalúrgico;RUA CAMPOS ALTOS, 345;(31) 3853-1412;;contabilidadeduarte@globo.com;;;"11.079777.85.0001-1";"7711-0/00-LOCADORA DE AUTOMÓVEIS (Secundário)";;0
COMERCIO E LOCAÇAO DE VEICULOS KNIPPELBERG LTDA - EPP;INFINITY LOCAÇÃO DE AUTOMOVEIS;"19.041.350/0001-24";Empresário Individual (Não MEI);;Empresa de Pequeno Porte;Em Operação;Locadora de Veículos;Aluguel de Veículos;78.015.300;MT;Cuiabá;Dom Aquino;AV GENERAL MELLO, Nº 1258;(65) 3358-6642;(65) 3358-6702;bruno.2030@hotmail.com;;;"13.078944.85.0001-0";"7711-0/00-LOCADORA DE AUTOMÓVEIS (Secundário)";Nenhuma das Opções;0
SILVANO FELIX DE MELO - ME;SILVANO VIAGENS E TURISMO;"19.039.208/0001-42";Empresário Individual (Não MEI);;Microempresa;Em Operação;Locadora de Veículos;Aluguel de Veículos;57.039.850;AL;Maceió;Ipioca;RUA MANOEL LOPES DOS SANTOS, S/N;(82) 8843-8579;;bruno3566@hotmail.com;;;"02.058338.85.0001-0";"7711-0/00-LOCADORA DE AUTOMÓVEIS (Primário), 7912-1/00-OPERAÇÕES DE VIAGEM; SERVIÇOS DE (Secundário)";Nenhuma das Opções;0
ALL TIME COMÉRCIO DE PEÇAS E SERVIÇOS LTDA ME.;ALL SERVICE;"08.013.749/0001-85";Sociedade Empresária;;Microempresa;Em Operação;Locadora de Veículos;Aluguel de Veículos;3.309.000;SP;São Paulo;Vila Gomes Cardim;RUA SERRA DE JAPI, 731 - CASA 01;(11) 4119-0190;(11) 3499-9616;contato@vaidevan.com;;;"26.070421.85.0001-9";"7711-0/00-LOCADORA DE AUTOS (Secundário), 7711-0/00-LOCADORA DE CARROS (Secundário)";Mandarim ,Espanhol ,Inglês;0
DANTAS & DANTAS LOCAÇÕES E TURISMO LTDA - ME;NASA LOCAÇÕES E TURISMO;"20.907.744/0001-00";Sociedade Empresária;;Microempresa;Em Operação;Locadora de Veículos;Aluguel de Veículos;59.084.200;RN;Natal;Neópolis;AV DAS ALAGOAS, 39;(84) 9938-5530;;naldo24horasturismo@hotmail.com;;;"20.069186.85.0001-3";"4929-9/02-TRANSPORTE RODOVIÁRIO COLETIVO DE PASSAGEIROS. SOB REGIME DE FRETAMENTO, INTERMUNICIPAL, INTERESTADUAL E INTERNACIONAL (Secundário), 7711-0/00-LOCADORA DE AUTOMÓVEIS (Secundário)";Espanhol;0
JULIANA FERREIRA CORREIA - ME;SHOW EXPRESS;"08.879.106/0001-19";Empresário Individual (Não MEI);;Microempresa;Em Operação;Locadora de Veículos;Aluguel de Veículos;4.195.110;SP;São Paulo;Jardim Celeste;RUA ALEXANDRE PAPIN, 52 - APTO 54;(11) 2373-3148;;showexpress@gmal.com;;www.showexpress.com.br;"26.072762.85.0001-7";"7711-0/00-LOCADORA DE AUTOMÓVEIS (Secundário)";Inglês;0
MIRANDA'S TRANSPORTES LTDA -ME;MIRANDA'S TRANSPORTES;"10.826.781/0001-21";Sociedade Empresária;;Microempresa;Em Operação;Locadora de Veículos;Aluguel de Veículos;29.169.830;ES;Serra;Pitanga;RUA MIGUEL JOSÉ,11;(27) 3241-8854;(27) 99651-9883;gefferson31@hotmail.com;;;"08.081736.85.0001-8";"7711-0/00-LOCADORA DE AUTOMÓVEIS (Secundário)";Nenhuma das Opções;0
GG DE OLIVEIRA - ME;LYNETUR  VIAGENS E TURISMO;"21.841.175/0001-00";Empresário Individual (Não MEI);;Microempresa;Em Operação;Locadora de Veículos;Aluguel de Veículos;59.088.500;RN;Natal;Neópolis;AV SÃO MIGUEL DOS CARIBES, 41;(84) 99418-9817;;gleydsongomes@hotmail.com;;;"20.075177.85.0001-0";"7711-0/00-LOCADORA DE AUTOMÓVEIS (Secundário)";;0
MVA ENGENHARIA ELETRICA LTDA - ME;MVA ENGENHARIA;"18.195.795/0001-04";Microempreendedor Individual (MEI);;Mei;Em Operação;Locadora de Veículos;Aluguel de Veículos;76.450.000;GO;Minaçu;Minaçu;RUA 11 Q.88 LT-10A - CENTRO;(62) 8483-3398;;mva.engenharia@hotmail.com;;;"09.074869.85.0001-6";"7711-0/00-LOCADORA DE AUTOMÓVEIS (Secundário)";Nenhuma das Opções;0
LIDER RENTA CAR ALUGUEL DE VEICULOS EIRELI ME;LIDER RENTA CAR;"12.363.055/0001-45";Empresa Individual (EIRELI);"20/10/2001";Microempresa;Em Operação;Locadora de Veículos;Aluguel de Veículos;33.125.250;MG;Santa Luzia;São Benedito;RUA ITAREMA, 366;(31) 3388-2807;(34) 3811-1246;liderrentacar@hotmail.com;;WWW.CLERITUR.COM.BR;"11.061374.85.0001-8";"7911-2/00-AGÊNCIA DE VIAGEM; SERVIÇO DE (Secundário), 7711-0/00-LOCADORA DE AUTOMÓVEIS (Secundário)";Nenhuma das Opções;0
ANTONIO RICARDO MARTINS ME;LL TRANSPORTES;"06.256.766/0001-18";Empresário Individual (Não MEI);;Microempresa;Em Operação;Locadora de Veículos;Aluguel de Veículos;38.401.574;MG;Uberlândia;Vila Maria;RUA 21 DE ABRIL 1432;(34) 3255-8951;(34) 9966-0796;ricardomartins70@yahoo.com.br;;;"11.074719.85.0001-5";"7711-0/00-LOCADORA DE AUTOMÓVEIS (Secundário)";Nenhuma das Opções;0
RESTAURANTE MESQUITA RIBEIRO LTDA;RAJA RESTAURANTE E PIZZARIA;"07.985.008/0001-01";Sociedade Empresária;"03/05/2006";Microempresa;Em Operação;Locadora de Veículos;Aluguel de Veículos;76.420.000;GO;Niquelândia;Niquelândia;AV. BRASIL N-130;(62) 3354-3286;;mesquitaribeiro@gmail.com;;;"09.037093.85.0001-7";"5611-2/01-RESTAURANTES E SIMILARES (Primário), 7711-0/00-LOCADORA DE AUTOMÓVEIS (Secundário)";Nenhuma das Opções;0
TZAL AGENCIA DE VIAGENS E LOC. DE VEICULOS LTDA-ME;TZA TRANSPORTE;"17.241.643/0001-20";Sociedade Empresária;"06/02/1987";Microempresa;Em Operação;Locadora de Veículos;Aluguel de Veículos;22.783.115;RJ;Rio de Janeiro;Curicica;EST. DOS BANDEIRANTES N 8325 APT 207 BL.2;(21) 9641-1893;(21) 9225-3117;tzatransportes@gmail.com;;;"19.052006.85.0001-7";"7911-2/00-AGÊNCIA DE VIAGEM; SERVIÇO DE (Secundário), 7711-0/00-LOCADORA DE AUTOMÓVEIS (Secundário)";Nenhuma das Opções;0
LUV - X  LOCADORA E TURISMO LTDA;LUV - X LOCADORA E TURISMO;"14.194.671/0001-45";Sociedade Empresária;;Microempresa;Em Operação;Locadora de Veículos;Aluguel de Veículos;36.201.082;MG;Barbacena;Santa Tereza I;RUA CAMPOS SALES, 431 CASA;(32) 3331-5756;;luciano.dornellas@hotmail.com;;;"11.057872.85.0001-4";"7711-0/00-LOCADORA DE AUTOMÓVEIS (Primário)";Inglês;0
L.D.S. TRANSPORTE E SERVIÇOS LTDA;LDS TRANSPORTE E SERVIÇOS LTDA;"13.069.001/0001-34";Empresa Individual (EIRELI);;Empresa de Médio ou Grande Porte;Em Operação;Locadora de Veículos;Aluguel de Veículos;1.449.001;SP;São Paulo;Jardim Europa;AVENIDA EUROPA 877;(11) 3060-5460;;leonardo@ldsgroup.com.br;;www.ldsgroup.combr;"26.073922.85.0001-7";"7711-0/00-LOCADORA DE AUTOMÓVEIS (Primário)";Espanhol ,Italiano ,Inglês;0
STYLLUS CAR LOCAÇÃO DE VEICULOS LTDA - ME;STYLLUS CAR LOCAÇÃO DE VEICULOS LTDA - ME;"07.181.460/0001-02";Sociedade Empresária;;Microempresa;Em Operação;Locadora de Veículos;Aluguel de Veículos;3.582.060;SP;São Paulo;Jardim Brasília (Zona Leste);R GIRASSOLINA, 249;(11) 2741-1609;(11) 2741-1609;joser.andrade8@gmail.com;;;"26.070945.85.0001-8";"4929-9/02-TRANSPORTE RODOVIÁRIO COLETIVO DE PASSAGEIROS. SOB REGIME DE FRETAMENTO, INTERMUNICIPAL, INTERESTADUAL E INTERNACIONAL (Primário), 7711-0/00-LOCADORA DE AUTOMÓVEIS (Secundário)";Espanhol ,Inglês;0
BM TUR TRANSPORTES LTDA.;BM TUR TRANSPORTES;"03.835.558/0001-85";Sociedade Empresária;;Microempresa;Em Operação;Locadora de Veículos;Aluguel de Veículos;57.680.000;AL;Boca da Mata;Boca da Mata;RUA ELIAS ALVES, 50;(82) 3324-5124;(82) 3324-5124;j.aznascimento@gmail.com;;;"02.043907.85.0001-0";"4929-9/4-ORGANIZAÇÃO DE EXCURSÕES EM VEÍCULOS RODOVIÁRIOS PRÓPRIOS INTERNACIONAL  (Primário), 7711-0/00-LOCADORA DE AUTOMÓVEIS (Secundário)";Nenhuma das Opções;0
PROENÇA LOCADORA DE  VEÍCULOS E AGÊNCIA DE VIAGENS S/S LTDA - ME;CFC - B - SANTA RITA ;"10.584.237/0001-10";Sociedade Simples;;Microempresa;Em Operação;Locadora de Veículos;Aluguel de Veículos;14.870.330;SP;Jaboticabal;Centro;RUA BARÃO DO RIO BRANCO, 526 - SALA 04;(16) 3204-3559;;eduardo@cfcbarao.com.br;;;"26.070537.85.0001-4";"7711-0/00-LOCADORA DE AUTOMÓVEIS (Primário), 7911-2/00-AGÊNCIA DE VIAGEM; SERVIÇO DE (Secundário)";Nenhuma das Opções;0
RDV LOCADORA VANS E VEICULOS ESPECIAIS EIRELI ME;RDV LOCADORA VANS E VEICULOS ESPECIAIS EIRELI ME;"20.656.160/0001-09";Empresa Individual (EIRELI);;Microempresa;Em Operação;Locadora de Veículos;Aluguel de Veículos;2.552.000;SP;São Paulo;Vila Bandeirantes;AV.JOSE DE BRITO DE FREITAS Nº844;(11) 2364-8421;(11) 2364-8421;regis.gajardoni@hotmail.com;;;"26.072042.85.0001-6";"7711-0/00-LOCADORA DE AUTOMÓVEIS (Primário)";Espanhol ,Inglês;0
E. P. DE ANDRADE TRANSPORTES - ME;ANDRADE TURISMO;"21.900.541/0001-46";Empresário Individual (Não MEI);;Microempresa;Em Operação;Locadora de Veículos;Aluguel de Veículos;12.580.000;SP;Roseira;Roseira;RODOVIA WASHINGTON LUIZ SP 62 KM 166 + 300M Nº280/ CASA: CHAC REGIÃO FAZENDA;(12) 3646-1303;;andradeturismo2015@gmail.com;;;"26.073923.85.0001-4";"7711-0/00-LOCADORA DE AUTOMÓVEIS (Secundário)";Nenhuma das Opções;0
JAQUELINE MONTEIRO BALIEIRO - ME;JAKTUR;"22.807.001/0001-85";Empresário Individual (Não MEI);"01/10/2005";Microempresa;Em Operação;Locadora de Veículos;Aluguel de Veículos;31.360.120;MG;Belo Horizonte;Itatiaia;RUA JOSÉ ALVES DE SOUZA;(31) 3498-0051;;lbjackyy@hotmail.com;;;"11.072336.85.0001-5";"7711-0/00-LOCADORA DE AUTOMÓVEIS (Primário)";;0
REALTUR TRANSPORTE LTDA - ME;REALTUR ;"13.302.111/0001-02";Empresário Individual (Não MEI);;Empresa de Pequeno Porte;Em Operação;Locadora de Veículos;Aluguel de Veículos;39.470.000;MG;Itacarambi;Itacarambi;RUA TIRADENTES , 305 B;(38) 9109-2607;(38) 9109-2607;realtur@yahoo.com.br;;;"11.048212.85.0001-4";"4929-9/02-TRANSPORTE RODOVIÁRIO COLETIVO DE PASSAGEIROS. SOB REGIME DE FRETAMENTO, INTERMUNICIPAL, INTERESTADUAL E INTERNACIONAL (Secundário), 7711-0/00-LOCADORA DE AUTOMÓVEIS (Secundário), 7911-2/00-TURISMO; AGÊNCIA DE (Secundário), 4923-0/02-ALUGUEL DE AUTOMÓVEIS COM MOTORISTA, MUNICIPAL (Secundário)";Nenhuma das Opções;0
GUILHERME HENRIQUE SOUZA CALDEIRA .ME;TRANSCARMO  LOCADORA;"14.947.044/0001-38";Empresa Individual (EIRELI);;Microempresa;Em Operação;Locadora de Veículos;Aluguel de Veículos;37.225.000;MG;Carmo da Cachoeira;Carmo da Cachoeira;RUA DOMINGOS RIBEIRO DE REZENDE ,526;(35) 3225-1437;(35) 32225-1437;guicaldeira07@gmail.com;;;"11.057571.85.0001-0";"7711-0/00-LOCADORA DE AUTOMÓVEIS (Primário)";Inglês;0
G. DOS SANTOS GOULART - ME;MS TRANSPORTES;"18.911.833/0001-70";Empresário Individual (Não MEI);;Microempresa;Em Operação;Locadora de Veículos;Aluguel de Veículos;79.290.000;MS;Bonito;Bonito;RUA DAS ÁGUAS MARINHAS, 695;(67) 9133-3637;(67) 9641-5483;gilvangoulartms@hotmail.com;;;"12.057848.85.0001-0";"7711-0/00-LOCADORA DE AUTOMÓVEIS (Secundário)";Espanhol ,Inglês;0
ALLMAR TRANSPORTES E TURISMO LTDA - ME;ALLMAR TURISMO;"16.881.192/0001-22";Sociedade Empresária;;Microempresa;Em Operação;Locadora de Veículos;Aluguel de Veículos;71.881.321;DF;Riacho Fundo;Riacho Fundo II;QN 15B, CONJ. 01 LOTE 05 ;(61) 4103-5100;(61) 8156-1211;allmarturismo@gmail.com;;;"07.056697.85.0001-8";"7711-0/00-LOCADORA DE AUTOMÓVEIS (Primário), 7911-2/00-AGÊNCIA DE VIAGEM; SERVIÇO DE (Secundário), 4929-9/01-TRANSPORTE RODOVIÁRIO COLETIVO DE PASSAGEIROS, SOB REGIME DE FRETAMENTO, MUNICIPAL (Secundário)";Nenhuma das Opções;0
LYNEAR VEICULOS LTDA-ME;GOAL TURISMO;"27.682.814/0001-00";Sociedade Empresária;"10/01/2002";Microempresa;Em Operação;Locadora de Veículos;Aluguel de Veículos;20.270.021;RJ;Rio de Janeiro;Maracanã;RUA SENADOR FURTADO 15, FUNDOS;(21) 2524-8008;(21) 2524-8008;ramon.pires@goalprime.com;;www.goallocadora.com.br;"19.053856.85.0001-7";"7711-0/00-LOCADORA DE AUTOMÓVEIS (Primário), 4929-9/02-TRANSPORTE RODOVIÁRIO COLETIVO DE PASSAGEIROS. SOB REGIME DE FRETAMENTO, INTERMUNICIPAL, INTERESTADUAL E INTERNACIONAL (Secundário)";Francês ,Inglês;0
ARIANE FACCHIN ALBUQUERQUE - ME;A G TRANSPORTES;"18.570.495/0001-50";Empresário Individual (Não MEI);;Microempresa;Em Operação;Locadora de Veículos;Aluguel de Veículos;79.290.000;MS;Bonito;Bonito;RUA PERCIO SCHAMANN, 793 - CASA 01;(67) 9127-3792;(67) 3255-1659;contecbonito@hotmail.com;;;"12.057303.85.0001-1";"7711-0/00-LOCADORA DE AUTOMÓVEIS (Secundário)";Nenhuma das Opções;0
ADRIANA GOUVEIA TEIXEIRA CALADO - LOCADORA - ME;ADRIANA GOUVEIA TEIXEIRA CALADO - LOCADORA - ME;"10.468.732/0001-64";Empresário Individual (Não MEI);;Microempresa;Em Operação;Locadora de Veículos;Aluguel de Veículos;16.403.266;SP;Lins;Jardim Guanabara;AVENIDA SÃO PAULO 1595;(14) 3523-4478;;adrianagtcalado@hotmail.com;;;"26.075841.85.0001-6";"7711-0/00-LOCADORA DE AUTOMÓVEIS (Primário)";Nenhuma das Opções;0
THERCIO CARNEIRO DE OLIVEIRA EIRELI - ME;LOCAVELTHE ;"08.113.593/0001-04";Empresa Individual (EIRELI);;Empresa de Pequeno Porte;Em Operação;Locadora de Veículos;Aluguel de Veículos;59.625.000;RN;Mossoró;Ilha de Santa Luzia;AV. PRESIDENTE DUTRA, Nº 1815 (ALTO DE SÃO MANOEL);(84) 3312-0058;;thercio_carn@hotmail.com;;www.locavelthe.com.br;"20.066320.85.0001-9";"7711-0/00-LOCADORA DE CARROS (Primário), 7711-0/00-LOCADORA DE AUTOMÓVEIS (Secundário)";;0
MOUNTAIN WORLD FRETAMENTO E TRANSPORTE DE PASSAGEIROS E CARGAS LTDA - ME;MOUNTAIN WORLD TOUR;"16.830.979/0001-65";Sociedade Empresária;;Microempresa;Em Operação;Locadora de Veículos;Aluguel de Veículos;13.312.710;SP;Itu;Parque Residencial Potiguara;AV. PASQUALE IAQUINTO, Nº 224;(11) 95478-6900;(11) 4013-8060;camila@gisacontabilidade.com.br;;;"26.078134.85.0001-7";"4929-9/02-TRANSPORTE RODOVIÁRIO COLETIVO DE PASSAGEIROS. SOB REGIME DE FRETAMENTO, INTERMUNICIPAL, INTERESTADUAL E INTERNACIONAL (Primário), 7711-0/00-LOCADORA DE AUTOMÓVEIS (Secundário), 4923-0/02-SERVIÇO DE TRANSPORTE DE PASSAGEIROS - LOCAÇÃO DE AUTOMÓVEIS COM MOTORISTA (Secundário)";Nenhuma das Opções;0
S GARCEZ LOCAÇÃO DE VEICULOS LTDA - ME;S GARCEZ LOCAÇÃO E TRANSPORTES;"10.920.318/0001-44";Sociedade Empresária;;Microempresa;Em Operação;Locadora de Veículos;Aluguel de Veículos;2.205.220;SP;São Paulo;Vila Ede;V DE PEDESTRE EAGRO, N°: 05;(11) 4597-1517;;sgarcez@sgarcez.com.br;;;"26.070541.85.0001-7";"7711-0/00-LOCADORA DE AUTOMÓVEIS (Secundário)";Nenhuma das Opções;0
C. P. DE SOUZA RODRIGUES LOCACAO DE VEICULOS - ME;CRIS VAN;"08.199.015/0001-32";Empresário Individual (Não MEI);;Microempresa;Em Operação;Locadora de Veículos;Aluguel de Veículos;16.203.225;SP;Birigüi;Núcleo Habitacional Thereza Maria Barbieri;"AVENIDA DAS ROSAS; N° 1304   ";(18) 3634-2399;;crisvanlocadoradeveiculos@hotmail.com;;;"26.077444.85.0001-5";"7711-0/00-LOCADORA DE AUTOMÓVEIS (Primário)";Nenhuma das Opções;0
GONÇALO DE SOUZA E MARQUES DE SOUZA LTDA - EPP;AUTO & CIA RENT A CAR;"13.843.787/0001-03";Sociedade Simples;;Empresa de Pequeno Porte;Em Operação;Locadora de Veículos;Aluguel de Veículos;78.025.700;MT;Cuiabá;Jardim Ubatã;AVENIDA MIGUEL SUTIL, 14444, ANEXO A, PORTO;(65) 3637-3399;(65) 3637-3793;andremarques@autoeciarentacar.com.br;financeiro1@autoeciarentacar.com.br;;"13.070070.85.0001-5";"7711-0/00-LOCADORA DE AUTOMÓVEIS (Primário)";Nenhuma das Opções;0
ELVE EMPRESA LOCADORA DE VEICULOS ESPECIAIS LTDA-ME;ELVE BLINDADOS;"11.813.341/0001-00";Sociedade Empresária;;Microempresa;Em Operação;Locadora de Veículos;Aluguel de Veículos;21.061.020;RJ;Rio de Janeiro;Bonsucesso;AV ITAOCA, 82;(21) 2560-0293;;fabiano.marins@elve.com.br;;www.elve.com.br;"19.056860.85.0001-3";"7711-0/00-LOCADORA DE AUTOMÓVEIS (Primário)";Espanhol ,Inglês;0
TARGET LOCADORA DE VEICULOS LTDA ME;BELLA LOCADORA;"16.872.836/0001-16";Sociedade Empresária;;Empresa de Médio ou Grande Porte;Em Operação;Locadora de Veículos;Aluguel de Veículos;21.520.230;RJ;Rio de Janeiro;Pavuna;RUA HONORIO HERMETO 57 FUNDOS;(21) 2201-8505;(21) 2501-2363;leokorten@gmail.com;;;"19.050485.85.0001-3";"7911-2/00-AGÊNCIA DE VIAGEM; SERVIÇO DE (Secundário), 7711-0/00-LOCADORA DE AUTOMÓVEIS (Secundário)";;0
LUSMAR TUR LOCAÇÃO DE VEÍCULOS LTDA ME;LUSMAR TUR LOCAÇÃO DE VEÍCULOS LTDA ME;"09.436.714/0001-11";Sociedade Empresária;;Microempresa;Em Operação;Locadora de Veículos;Aluguel de Veículos;27.212.090;RJ;Volta Redonda;Vila Americana;RUA CUBA N°49;(24) 3346-8440;;bbsandra@ig.com.br;;;"19.061689.85.0001-1";"7711-0/00-LOCADORA DE AUTOMÓVEIS (Primário)";Inglês;0
INOVA SERVIÇOS LTDA-ME;INOVA LOCADORA DE VEICULOS;"07.924.535/0001-06";Sociedade Empresária;;Microempresa;Em Operação;Locadora de Veículos;Aluguel de Veículos;69.919.140;AC;Rio Branco;RESIDENCIAL PETRÓPOLIS;EST.DIAS MARTINS -156-NOVA AVENIDA CEARA;(68) 3229-3101;(68) 8115-5785;inova@inovalocadora.com.br;;;"01.062646.85.0001-3";"7711-0/00-LOCADORA DE AUTOMÓVEIS (Primário)";Nenhuma das Opções;0
AH-N TRANSPORTE DE LOCAÇAO LTDA - ME;AH-N LOCAÇÃO;"13.180.077/0001-32";Sociedade Empresária;;Microempresa;Em Operação;Locadora de Veículos;Aluguel de Veículos;38.402.266;MG;Uberlândia;Industrial;AVENIDA PAULO ROBERTO CUNHA SANTOS 1229, SALA 01;(34) 3223-9630;;ahnlocadora@hotmail.com;;;"11.048089.85.0001-9";"7911-2/00-AGÊNCIA DE VIAGEM; SERVIÇO DE (Secundário), 7711-0/00-LOCADORA DE AUTOMÓVEIS (Secundário)";Nenhuma das Opções;0
ROVEMA LOCADORA DE VEICULOS LTDA;HERTZ LOCADORA DE VEICULOS;"07.451.844/0002-89";Sociedade Empresária;;Empresa de Pequeno Porte;Em Operação;Locadora de Veículos;Aluguel de Veículos;69.914.220;AC;Rio Branco;Distrito Industrial;BR.364,KM.18-S/Nº AEROPORTO;(68) 3211-1022;(68) 3211-1039;hertzriobranco@gruporovema.com.br;;;"01.051176.85.0002-4";"7711-0/00-LOCADORA DE AUTOS (Primário)";Espanhol;0
F S C LOCAÇÃO DE VEÍCULOS LTDA - ME;LE MONDE RENT A CAR;"00.232.706/0001-89";Sociedade Empresária;;Microempresa;Em Operação;Locadora de Veículos;Aluguel de Veículos;60.175.135;CE;Fortaleza;Papicu;RUA PROFESSOR SILAS RIBEIRO, 209 - LOJA 03;(85) 3263-5519;(85) 3263-5519;lemonde@lemonderentacar.com.br;;;"06.077987.85.0001-8";"7711-0/00-LOCADORA DE AUTOMÓVEIS (Primário)";Inglês;0
DAISY CONSTRUÇÕES LTDA;DAISY CONSTRUÇÕES;"13.835.484/0001-30";Sociedade Empresária;;Microempresa;Em Operação;Locadora de Veículos;Aluguel de Veículos;49.160.000;SE;Nossa Senhora do Socorro;Nossa Senhora do Socorro;AV. COLETORA C, Nº 948 - CONJUNTO ALBANO FRANCO;(79) 9855-2505;;daisy_jesus@ig.com.br;;;"25.057851.85.0001-2";"7711-0/00-LOCADORA DE AUTOMÓVEIS (Primário)";Nenhuma das Opções;0
JOÃO PESSOA LOCADORA VIAGENS E TURISMO LTDA ME;JOÃO PESSOA RENT A CAR;"18.163.526/0001-58";Sociedade Empresária;;Microempresa;Em Operação;Locadora de Veículos;Aluguel de Veículos;58.038.242;PB;João Pessoa;Manaíra;AV POMBAL 1633 SALA 103;(83) 8803-3906;;lucas.jptur@hotmail.com;;;"15.054651.85.0001-7";"7711-0/00-LOCADORA DE AUTOMÓVEIS (Primário), 7911-2/00-AGÊNCIA DE VIAGEM; SERVIÇO DE (Secundário)";Inglês;0
